query_name,entity_type,source_file,description,keywords,variables,tested_status,pagination_behavior,notes
MousePhenotypesSummary,target,packages/sections/src/target/MousePhenotypes/MousePhenotypesSummary.gql,Retrieves mouse phenotype model IDs for a target gene to count distinct phenotypes observed in mouse models. Used by Summary component to display phenotype counts.,"target, mouse, phenotypes, model-organisms, mouse-models, summary, fragment, impc, mgi",ensemblId: String! (Example: ENSG00000157764),✅ Success,Full results,"Originally a fragment (MousePhenotypesSummaryFragment on Target), converted to standalone query. Query successfully tested with BRAF (ENSG00000157764), returned 77 mouse phenotype records with modelPhenotypeId values. Simple query returning mousePhenotypes array with only modelPhenotypeId field. No pagination - returns all phenotypes in single response. Used in Summary.jsx to count distinct phenotypes displayed as 'X distinct phenotype(s)'. Response includes array of objects each with single modelPhenotypeId (Mammalian Phenotype Ontology ID like MP:0000272). Related to MousePhenotypes.gql (full query) which fetches complete phenotype details: targetInModel, targetInModelMgiId, modelPhenotypeLabel, modelPhenotypeClasses array (id, label), biologicalModels array (id, allelicComposition, geneticBackground, literature) for detailed phenotype table display with categories and allelic composition."
MousePhenotypes,target,packages/sections/src/target/MousePhenotypes/MousePhenotypes.gql,"Retrieves mouse phenotype data for a target gene from the International Mouse Phenotype Consortium (IMPC). Returns phenotype observations from mouse models including phenotype labels, categories, and biological model details.","target, mouse-phenotypes, impc, phenotypes, mouse-models, mgi, biological-models, allelic-composition",ensemblId: String! (Example: ENSG00000157764),✅ Success,Full results,"Query successfully tested with BRAF (ENSG00000157764), returned 77 mouse phenotypes. No pagination - returns all phenotypes in single response. Response includes mousePhenotypes array with targetInModel (mouse gene symbol 'Braf'), targetInModelMgiId (MGI:88190), modelPhenotypeId (MP term like MP:0000272), modelPhenotypeLabel (human-readable like 'abnormal aorta morphology'), modelPhenotypeClasses array (categories with id and label like MP:0005385 'cardiovascular system phenotype'), biologicalModels array (id, allelicComposition like 'Braf<tm1Zim>/Braf<tm1Zim>', geneticBackground like 'involves: 129', literature array of PMID references). Data from IMPC database linking human genes to mouse phenotypes. No fragments to inline. Used in MousePhenotypes section Body component with filterable table. Related to MousePhenotypesSummary.gql which queries only count of phenotypes."
ProtVistaQuery,target,packages/sections/src/target/MolecularStructure/MolecularStructure.gql,"Retrieves protein identifiers for a target gene from multiple sources (UniProt SwissProt, UniProt TrEMBL, Ensembl, obsolete IDs). Used to fetch UniProt ID for displaying molecular structure data.","target, protein, uniprot, protein-ids, molecular-structure, identifiers, ensembl",ensemblId: String! (Example: ENSG00000157764),✅ Success,Full results,"Query successfully tested with BRAF (ENSG00000157764), returned 33 protein IDs from multiple sources. No pagination - returns all protein IDs in single response. Response includes proteinIds array with id (protein identifier) and source (uniprot_swissprot, uniprot_trembl, ensembl_PRO, uniprot_obsolete). Primary use case is extracting UniProt SwissProt ID (P15056 for BRAF) which is then used to fetch 3D structure data from AlphaFold API and PDB structures from UniProt API. No fragments to inline. Used in MolecularStructure section Body component to determine if structural data is available (hasData checks for uniprot_swissprot entries). Related query: summaryQuery.gql in same directory provides similar data for Summary component."
InteractionsStatsQuery,target,packages/sections/src/target/MolecularInteractions/InteractionsStats.gql,"Retrieves interaction counts from multiple databases (IntAct, Signor, Reactome, String) for a target gene, along with database version information for each interaction source. Used to populate the tab counts in the Molecular Interactions section.","target, molecular-interactions, intact, signor, reactome, string, database-versions, counts, statistics",ensgId: String! (Example: ENSG00000157764),✅ Success,Full results,"Query successfully tested with BRAF (ENSG00000157764), returned intact=464, signor=24, reactome=31, string=3077 interactions. No pagination - returns simple count values for each database. Response includes interactionResources array with databaseVersion and sourceDatabase (metadata showing versions: string=12, intact=250, reactome=92, signor=Not Available), and target object with id and aliased count fields (intact.count, signor.count, reactome.count, string.count). Used in Body.jsx via getSummaryCounts() to populate tab labels with count displays and version information in the Molecular Interactions section UI. Loads once on component mount to determine which tabs have data and set initial tab selection to first database with non-zero count. Related to MolecularInteractionsSummary.gql which provides total aggregate count (3596), and InteractionsSectionQuery.gql which fetches detailed interaction data with pagination for each database tab view."
InteractionsSectionQuery_String,target,packages/sections/src/target/MolecularInteractions/InteractionsStringQuery.gql,"Retrieves molecular interaction data from the STRING database for a target gene. Returns protein-protein functional interaction partners with interaction scores and evidence types across multiple categories (neighbourhood, gene fusion, co-occurrence, co-expression, experimental, database, text mining, homology).","target, molecular-interactions, string, protein-interactions, functional-interactions, interactors, evidence-scores, neighbourhood, gene-fusion, co-occurrence, co-expression, experimental, database, text-mining, homology","ensgId: String! (Example: ENSG00000157764), sourceDatabase: String (Example: string), index: Int (default: 0), size: Int (default: 10)",✅ Success,"Paginated (returns 10/page default, typically 3000/batch for full load)","Query successfully tested with BRAF (ENSG00000157764) and sourceDatabase='string', returned count=3077 total STRING interactions. Uses offset-based pagination with index and size parameters. Default size=10 but application code uses size=3000 to fetch all interactions in single batch for client-side table. Returns count (total interactions) and rows array with interaction data. Response includes intA (Ensembl protein ID like ENSP00000419060), intB (partner protein ID), targetB object (id, approvedSymbol like RAF1, MAP2K1) or null if not in Open Targets, score (0-1 overall interaction confidence like 0.999), evidences array with evidenceScore (0-1) and interactionDetectionMethodShortName (neighbourhood, fusion, cooccurence, coexpression, experimental, database, textmining, homology). STRING database provides functional protein-protein interactions with scores from multiple evidence types. No fragments to inline. Used in StringTab component which fetches with size=3000 to load full dataset for heatmap table display showing interaction partners and evidence breakdown. Sample: BRAF-RAF1 interaction score 0.999 with evidence from textmining (0.983), database (0.9), experimental (0.927), cooccurence (0.066), homology (0.945). Related to InteractionsQuery.gql (InteractionsSectionQuery) for IntAct/Signor/Reactome databases and InteractionsStats.gql for cross-database count summary."
PathwaysSummary,target,packages/sections/src/target/Pathways/PathwaysSummary.gql,Retrieves pathway IDs for a target to display pathway count summary. Used in the Pathways section summary widget to show how many Reactome pathways are associated with a given target.,"target, pathways, reactome, summary",ensemblId: String! (Example: ENSG00000157764),✅ Success,Full results,"Originally a fragment (PathwaysSummaryFragment on Target), converted to standalone query. Query successfully tested with BRAF (ENSG00000157764), returned 16 pathway IDs. No pagination - returns all pathway associations in single response. Response includes target object with id (Ensembl gene ID) and pathways array containing pathwayId (Reactome pathway identifier like R-HSA-9726842). Used in Summary.jsx component to render pathway count in section summary widget via renderSummary callback: '${pathways.length} Reactome pathways'. The summary component uses this minimal query to efficiently check pathway data availability and display count, while the main Body component uses the full Pathways.gql query which includes additional fields (pathway name, topLevelTerm) for the detailed pathway table. Fragment inlined with id field added for proper query structure. Related to Pathways.gql which provides full pathway details (pathwayId, pathway, topLevelTerm) for the detailed table view."
OverlappingVariantsSummary,target,packages/sections/src/target/OverlappingVariants/OverlappingVariantsSummary.gql,Retrieves the count of protein coding variants overlapping with a target gene. Used to determine if the Protein Coding Variants section should be displayed.,"target, protein-coding-variants, variants, count, summary",ensemblId: String! (Example: ENSG00000157764),✅ Success,Full results,"Originally a fragment (OverlappingVariantsSummaryFragment on Target), converted to standalone query. Query successfully tested with BRAF (ENSG00000157764), returned count=527 protein coding variants. No pagination - returns only the count field, not the actual variant data. Response includes target object with id (Ensembl gene ID) and proteinCodingCoordinates object containing count (integer representing total number of protein-coding variants overlapping the gene). Used in Summary.tsx component to determine section visibility via hasData function which checks if count > 0. The summary component uses this minimal query to efficiently check data availability, while the main Body component uses OverlappingVariantsQuery.gql which paginates through actual variant rows with full details (datasources, uniprotAccessions, variant coordinates, aminoAcid positions, diseases, consequences). Fragment inlined with id field added for proper query structure. Related to OverlappingVariantsQuery.gql which provides paginated full variant details with size=500/batch for the detailed variant table and 3D protein viewer."
OverlappingVariantsQuery,target,packages/sections/src/target/OverlappingVariants/OverlappingVariantsQuery.gql,"Fetches protein coding variants that overlap with the target gene, including variant details, affected diseases, and variant consequences. Displays amino acid changes, genomic positions, datasource information, and therapeutic area associations.","protein-coding-variants, variant-consequences, amino-acid-changes, genomic-variants, therapeutic-areas, variant-effect, uniprot, clinvar","ensemblId: String! (Example: ENSG00000157764), size: Int! (Example: 500), index: Int! (Example: 0)",✅ Success,"Paginated (batch: 500/page, may auto-fetch all)","Query successfully tested with BRAF (ENSG00000157764), returned count=527 protein coding variants. Uses offset-based pagination with index and size parameters. Application uses useBatchQuery with table5HChunkSize=500 to automatically fetch all results in batches. Returns count (total variants) and rows array with variant data. Response includes datasources (datasourceId like 'eva', 'eva_somatic', 'uniprot_variants' with datasourceNiceName and datasourceCount), uniprotAccessions, alternateAminoAcid, variant object (id, chromosome, position, referenceAllele, alternateAllele), target.id, aminoAcidPosition, referenceAminoAcid, diseases array (id, name), therapeuticAreas array, variantConsequences array (id like SO:0001583, label like missense_variant), and variantEffect score (0-1 confidence or null). Used in OverlappingVariants section (Protein Coding Variants widget) with split view showing data table (60%) and AlphaFold 3D structure viewer (40%). Sample data: BRAF S744T variant (7_140734667_C_G) linked to Noonan syndrome and CFC syndrome from ClinVar with variantEffect=0.173. No fragments to inline."
Pathways,target,packages/sections/src/target/Pathways/Pathways.gql,"Fetches pathway information for a target gene from Reactome, including pathway names, IDs, and top-level parent pathways. Used to populate the Pathways section table showing all biological pathways the target is involved in.","target, pathways, reactome, biological-pathways, gene-pathways, top-level-term",ensemblId: String! (Example: ENSG00000157764),✅ Success,Full results,"Query successfully tested with BRAF (ENSG00000157764), returned 16 Reactome pathways. No pagination - returns all pathway associations in single response. Response includes target object with id (Ensembl gene ID), approvedSymbol (gene symbol like BRAF), and pathways array containing pathwayId (Reactome pathway identifier like R-HSA-9726842), pathway (pathway name like 'Gain-of-function MRAS complexes activate RAF signaling'), and topLevelTerm (top-level parent category like 'Disease' or 'Signal Transduction'). Used in Body.jsx component to render an OtTable with three columns: Pathway column links to identifiers.org Reactome page, Top-level parent pathway shows categorization, and View target and pathway links to Reactome pathway browser with target highlighted. No fragments to inline. Sample data: BRAF participates in 16 pathways including RAF activation, MAPK pathway regulation, and various disease-related pathways, with top-level terms primarily in Disease and Signal Transduction categories. Related to PathwaysSummary.gql which provides minimal query (just pathwayId) for count display in section summary widget."
Safety,target,packages/sections/src/target/Safety/Safety.gql,"Fetches safety liabilities data for a target including adverse events, biosamples, dosing effects, experimental studies, and data sources. Used in the Safety section to display safety information associated with target modulation.","safety, liabilities, adverse events, biosamples, dosing effects, toxicity, target safety",ensemblId: String! (Example: ENSG00000157764),✅ Success,Full results,"Query successfully tested with BRAF (ENSG00000157764), returned 1 safety liability entry. No pagination - returns all safety liabilities in single response. Response includes target object with id (Ensembl gene ID) and safetyLiabilities array containing event (adverse event name like 'heart disease'), eventId (disease ontology ID like EFO_0003777), biosamples array (cellFormat, cellLabel, tissueLabel, tissueId), effects array (dosing description, direction like 'Activation/Increase/Upregulation' or 'Inhibition/Decrease/Downregulation'), studies array (name, type like 'preclinical', description of experimental findings), datasource (reference name like 'Force et al. (2011)'), literature (PubMed ID), url (external reference URL). Used in Body.jsx component to render OtTable with columns for safety event (linked to disease page if eventId exists), biosystems (with TableDrawer showing cell types/tissues), dosing effects (up/down regulation icons with tooltips), experimental studies (SafetyStudiesDrawer), and source (with PublicationsDrawer or external link). Sample data for BRAF shows heart disease safety liability from preclinical studies showing left ventricular dysfunction in knockout mice, sourced from Force et al. (PMID: 21283106). No fragments to inline. Section is displayed when safetyLiabilities array length > 0."
SafetySummary,target,packages/sections/src/target/Safety/summaryQuery.gql,Fetches safety liability events for a target to display a summary count of unique safety events. Used to determine if the Safety section should be displayed and to show a count of unique adverse events.,"target, safety, liabilities, adverse-events, toxicity, safety-events, summary",ensemblId: String! (Example: ENSG00000157764),✅ Success,Full results,"Originally a fragment (SafetySummaryFragment on Target), converted to standalone query. Query successfully tested with BRAF (ENSG00000157764), returned 1 safety event (heart disease). No pagination - returns all safety liabilities in single response. Response includes target object with id (Ensembl gene ID) and safetyLiabilities array containing event field (string describing the adverse event like 'heart disease', 'seizure', 'hepatotoxicity'). Used in Summary.jsx component to display section availability via renderSummary which counts uniqueEvents using lodash uniqBy to deduplicate events and shows '${uniqueEvents.length} unique safety events'. This is a minimal query used only for summary/count purposes - fetches only the event name field. The full safety data with detailed fields (eventId, biosamples, effects, studies, datasource, literature, url) is fetched by Safety.gql which includes ~10 additional nested fields per safety liability record for the detailed table display in Body.jsx. Data sourced from safety databases tracking known adverse events and toxicity signals for drug targets. No fragments to inline. Related to Safety.gql which fetches comprehensive safety liability data including biosystem details, dosing effects, experimental studies, and literature references for table display in the Safety section."
SubcellularLocation,target,packages/sections/src/target/SubcellularLocation/SubcellularLocation.gql,"Fetches subcellular location data for a target from UniProt and HPA sources, including location terms and protein IDs.","subcellular-location, protein, uniprot, hpa, localization, cellular-component",ensemblId: String! (Example: ENSG00000157764),✅ Success,Full results,"Query successfully tested with BRAF (ENSG00000157764), returned 12 subcellular locations and 32 protein IDs. No pagination - returns all subcellular location data in single response. Response includes target object with id (Ensembl gene ID), subcellularLocations array (source: uniprot/HPA_main/HPA_additional, location: human-readable location name like Nucleus/Cytoplasm/Cell membrane, termSL: SL ontology term identifier like SL-0191 or null for some HPA locations), and proteinIds array (id: protein identifier, source: uniprot_swissprot/uniprot_trembl/ensembl_PRO/uniprot_obsolete). Used in Body.jsx component to render SubcellularViz visualization showing cellular compartment distribution from UniProt and Human Protein Atlas (HPA). Sample BRAF data: 3 UniProt locations (Nucleus SL-0191, Cytoplasm SL-0086, Cell membrane SL-0039), 2 HPA_main locations (Cytosol, Vesicles), 7 HPA_additional locations (various cellular components including Primary cilium, Plasma membrane), plus protein IDs including P15056 (SwissProt) and multiple TrEMBL/Ensembl variants. Data sources documented in Description.jsx as UniProt and HPA. No fragments to inline. Related to SubcellularLocationFragment.gql which provides minimal fragment with just source field for summary display."
TargetQTLCredibleSetsSummary,target,packages/sections/src/target/QTLCredibleSets/QTLCredibleSetsSummaryFragment.gql,Retrieves the total count of QTL credible sets associated with a target gene. Used to determine if the QTL Credible Sets section should be displayed.,"target, qtl, credible-sets, count, summary, molqtl",ensemblId: String! (Example: ENSG00000157764),✅ Success,Full results,"Originally a fragment (TargetQTLCredibleSetsSummaryFragment on Target), converted to standalone query. Query successfully tested with BRAF (ENSG00000157764), returned count=112 QTL credible sets. No pagination - returns only the count field, not the actual credible set data. Response includes target object with id (Ensembl gene ID) and credibleSets object containing count (integer representing total number of molecular QTL credible sets associated with the gene). Used in Summary.tsx component to determine section visibility via hasData function which checks if count > 0. The summary component uses this minimal query (with page size=1, index=0) to efficiently check data availability, while the main Body component uses QTLCredibleSetsQuery.gql which paginates through actual credible set rows with full details (studyLocusId, variants, studies, p-values, beta values, fine-mapping methods). Fragment inlined with id field added for proper query structure. Related to QTLCredibleSetsQuery.gql which provides paginated full credible set details with size=500/batch for the detailed credible set table showing lead variants, study types, affected tissues, and fine-mapping confidence."
SubcellularLocationFragment,target,packages/sections/src/target/SubcellularLocation/SubcellularLocationFragment.gql,"Fetches subcellular location data for a target gene, including the source of the location data. Used in the Subcellular Location section summary to display count of available subcellular locations.","target, subcellular-location, cellular-component, localization, uniprot, HPA, summary",ensemblId: String! (Example: ENSG00000157764),✅ Success,Full results,"Originally a fragment (SubcellularLocationFragment on Target), converted to standalone query. Query successfully tested with BRAF (ENSG00000157764), returned 12 subcellular locations from multiple sources. No pagination - returns all subcellular location records in single response. Response includes target object with id (Ensembl gene ID) and subcellularLocations array containing source field (data source identifier like 'uniprot', 'HPA_main', 'HPA_additional'). For BRAF: returned 3 UniProt locations and 9 Human Protein Atlas (HPA) locations. Used in Summary.jsx component via usePlatformApi to display section availability with renderSummary showing '${subcellularLocations.length} subcellular locations'. This is a minimal query used only for summary/count purposes. The full query SubcellularLocation.gql fetches additional fields: location (subcellular compartment name), termSL (structured location term), and proteinIds (UniProt identifiers) for detailed visualization in SubcellularViz component. Data sourced from UniProt and Human Protein Atlas databases providing protein localization information. No nested fragments to inline. Related to SubcellularLocation.gql which fetches complete subcellular location data for the detailed section body view."
TractabilitySummary,target,packages/sections/src/target/Tractability/TractabilitySummary.gql,Fetches tractability modalities for a target to display a summary and determine if tractability assessment data is available. Used to indicate if tractability analysis exists for the target.,"target, tractability, modality, druggability, antibody, small-molecule, protac, therapeutic-modality, summary",ensemblId: String! (Example: ENSG00000157764),✅ Success,Full results,"Originally a fragment (TractabilitySummaryFragment on Target), converted to standalone query. Query successfully tested with BRAF (ENSG00000157764), returned 28 tractability records across 4 modalities: SM (Small Molecule, 8 records), AB (Antibody, 9 records), PR (PROTAC, 8 records), and OC (Other Clinical modalities, 3 records). No pagination - returns all tractability modality records in single response. Response includes target object with id (Ensembl gene ID) and tractability array containing modality field (code indicating therapeutic modality type: SM/AB/PR/OC). Used in Summary.jsx component via usePlatformApi to display section availability. The summary component has simplified UI that currently shows generic 'Assessment available' message instead of specific modality counts (commented code shows previous implementation that checked for specific modalities and displayed 'Antibody', 'Small molecule', 'PROTAC', 'Other clinical modalities'). This is a minimal query used only for summary/availability check - fetches only the modality code field. The full tractability data with detailed assessments (value, label fields) is fetched by TractabilityQuery.gql which includes additional fields for displaying detailed tractability table in Body.jsx showing which specific tractability criteria are met (value: boolean true/false) with descriptive labels for each assessment type. Data sourced from ChEMBL tractability pipeline analyzing druggability potential across different therapeutic approaches. No fragments to inline. Related to TractabilityQuery.gql which fetches comprehensive tractability assessment data including boolean values and descriptive labels for detailed section display with ModalityList components showing check/times icons for enabled/disabled criteria."
