query_name,entity_type,source_file,description,keywords,variables,tested_status,pagination_behavior,notes
TractabilityQuery,target,packages/sections/src/target/Tractability/TractabilityQuery.gql,"Retrieves tractability assessment data for a target gene across different therapeutic modalities (small molecule, antibody, PROTAC, other modalities). Returns binary assessments (true/false) for various tractability criteria within each modality category.","target, tractability, druggability, small-molecule, antibody, protac, therapeutic-modalities, drug-development, modality-assessment",ensemblId: String! (Example: ENSG00000157764),✅ Success,Full results,"Query successfully tested with BRAF (ENSG00000157764), returned 29 tractability assessments across 4 modalities. No pagination - returns all tractability assessments in single response. Response includes tractability array where each entry contains value (boolean true/false), modality (category code: SM=Small molecule, AB=Antibody, PR=PROTAC, OC=Other modalities), and label (assessment criteria description). For BRAF: Small molecule (SM) shows 8 assessments including 'Approved Drug'=true, 'Structure with Ligand'=true, 'High-Quality Ligand'=true, 'High-Quality Pocket'=true, 'Druggable Family'=true indicating strong small molecule tractability. Antibody (AB) shows 8 assessments with 'UniProt loc high conf'=true, 'GO CC high conf'=true, 'Human Protein Atlas loc'=true suggesting potential antibody tractability via subcellular location data. PROTAC (PR) shows 8 assessments with 'Literature'=true, 'UniProt Ubiquitination'=true, 'Database Ubiquitination'=true, 'Half-life Data'=true, 'Small Molecule Binder'=true indicating PROTAC feasibility. Other modalities (OC) shows 3 clinical stage assessments all false. No fragments to inline. Used in Body.jsx component which organizes results into 4 modality columns (Small molecule, Antibody, PROTAC, Other modalities) displaying each assessment with check/cross icons and labels. The component filters tractability array by modality code and renders enabled (value=true) items in bold primary color, disabled (value=false) in grey. Data sourced from ChEMBL (drug stages, structure quality, ligand binding), UniProt (subcellular location, ubiquitination sites), Gene Ontology (cellular component), Human Protein Atlas (protein localization), and literature mining. Used to assess drug development feasibility across different therapeutic approaches."
IntervalsSummaryFragment,variant,packages/sections/src/variant/Intervals/IntervalsSummaryFragment.gql,Retrieves the total count of genomic intervals (regulatory regions) associated with a variant from the Ensembl-to-Gene (E2G) model. Used to determine if the Intervals section has data to display.,"variant, intervals, e2g, regulatory, count, summary, genomic-intervals",variantId: String! (Example: 19_44908822_C_T),✅ Success,Full results,"Originally a fragment (IntervalsSummaryFragment on Variant), converted to standalone query. Query successfully tested with variants 19_44908822_C_T (returned count=58) and 1_113761186_C_A (returned count=1). No pagination - returns only the count field, not the actual interval data. Response includes variant object with intervals object containing count (integer representing total number of genomic intervals/regulatory regions associated with the variant). Used in Summary.tsx component to determine section visibility via hasData function which checks if count > 0. This is a minimal query used only for summary/availability check - fetches only the count field. The full interval data with detailed fields is fetched by IntervalsQuery.gql which uses pagination (size=3000, index=0) to retrieve actual interval rows with chromosome, start, end, target (gene), biosample (tissue/cell), score (E2G confidence 0-1), distanceToTss (distance to transcription start site), studyId (ENCODE experiment), intervalType, and resourceScore. Fragment inlined by wrapping in query declaration and adding variantId variable. Related to IntervalsQuery.gql which provides paginated full interval details for the detailed table showing genomic regions that may regulate genes, based on Ensembl-to-Gene predictions integrating epigenomic and 3D chromatin data from ENCODE and other sources."
EVASummary,variant,packages/sections/src/variant/EVA/EVASummaryFragment.gql,Retrieves the total count of ClinVar (EVA) evidences associated with a genetic variant. Used to determine if the ClinVar section should be displayed.,"variant, eva, clinvar, evidence, count, summary, clinical-significance",variantId: String! (Example: 19_44908822_C_T),✅ Success,Full results,"Originally a fragment (EVASummaryFragment on Variant), converted to standalone query. Query successfully tested with variants 19_44908822_C_T (rs7412, returned count=2) and 1_113761186_C_A (returned count=0). No pagination - returns only the count field, not the actual evidence data. Response includes variant object with id (variant identifier in chr_pos_ref_alt format) and evaEvidences object containing count (integer representing total number of EVA/ClinVar clinical significance evidences associated with the variant). Used in Summary.tsx component via usePlatformApi to determine section visibility via hasData function which checks if count > 0. The summary component uses this minimal query to efficiently check data availability, while the main Body component uses EVAQuery.gql which fetches full evidence details including disease associations, clinical significances, allele origins, review status, and literature references. EVA (European Variation Archive) evidences primarily come from ClinVar database providing clinical significance annotations. Fragment inlined with id field added for proper query structure. Related to EVAQuery.gql which provides full evidence details with rows array containing alleleOrigins, allelicRequirements, clinicalSignificances, cohortPhenotypes, confidence (review status), disease object, diseaseFromSource, studyId (ClinVar ID), and literature references for detailed ClinVar evidence table display."
IntervalsQuery,variant,packages/sections/src/variant/Intervals/IntervalsQuery.gql,"Fetches regulatory interval data for a variant, including gene associations, biosample context, interval types, scores, and genomic coordinates from the E2G (Enhancer to Gene) dataset.","variant, intervals, regulatory regions, E2G, gene regulation, enhancers, biosample, chromatin, genomic regions, distance-to-TSS, interval-type",variantId: String! (Example: 19_44908822_C_T),✅ Success,"Paginated (batch: 3000/page, may auto-fetch all)","Query successfully tested with two variants: 19_44908822_C_T (rs7412) returned 58 intervals linking to APOE and APOC1 genes, and 1_113761186_C_A (rs6679677) returned 1 interval linking to PHTF1 gene. Uses offset-based pagination with page: {size: 3000, index: 0} parameters. Response includes count (total intervals) and rows array with detailed interval data. Each row contains: chromosome, start, end (genomic coordinates), target object (id/Ensembl ID, approvedSymbol, approvedName for linked gene), pmid (PubMed reference), biosample object (biosampleId from UBERON/CL ontologies, biosampleName), score (0-1 E2G confidence score reflecting likelihood this region regulates target gene), resourceScore array (name/value pairs for DNase and HiC_contacts sub-scores), datasourceId (E2G), distanceToTss (distance in base pairs from transcription start site, can be negative), studyId (ENCODE experiment ID like ENCFF482HID), intervalType (genic or intergenic classification). The E2G score integrates epigenomic (DNase hypersensitivity) and 3D chromatin (Hi-C contacts) data to predict enhancer-to-gene regulatory relationships. No fragments to inline. Used in Body.tsx component with OtTable displaying sortable/filterable columns: Gene (links to target page), Affected tissue/cell (links to OBO ontology), Interval type, Study (links to ENCODE), Distance from start site (bp), Interval size (bp, calculated as end-start+1), Interval range (chr:start-end format with links), and Score (displayed with 3 decimal places, tooltip explaining E2G confidence interpretation). Table defaults to sort by score descending and shows 10 rows per page with pagination. Data sourced from Effector to Gene (E2G) predictions integrating ENCODE chromatin datasets. Used to identify regulatory regions where variants may affect gene expression through disruption of enhancer activity or chromatin interactions. For rs7412 (APOE variant): shows intervals in multiple tissue types (lung, brain, kidney, liver) with scores ranging from 0.973 to 0.600, primarily genic intervals with distances 1392-3014 bp from TSS, demonstrating tissue-specific regulatory potential of this clinically relevant Alzheimer's disease risk variant."
EVAQuery,variant,packages/sections/src/variant/EVA/EVAQuery.gql,"Fetches EVA (European Variation Archive) clinical evidence for a genetic variant, including ClinVar submissions with disease associations, clinical significance, allele origins, review status, and supporting literature.","variant, EVA, ClinVar, clinical-evidence, clinical-significance, disease-association, allele-origin, review-status, literature, genetic-variation",variantId: String! (Example: 19_44908822_C_T),✅ Success,Full results,"Query successfully tested with variant 19_44908822_C_T (rs7412), returned count=2 EVA evidences from ClinVar. No pagination - returns all EVA evidence records in single response. Response includes count (total number of clinical submissions) and rows array with detailed clinical evidence data. Each row contains: alleleOrigins (origin of allele: germline/somatic/etc), allelicRequirements (zygosity requirements like homozygous/heterozygous), clinicalSignificances (array of clinical classifications like 'drug response', 'benign', 'pathogenic'), cohortPhenotypes (array of reported phenotype terms from submitter), confidence (ClinVar review status like 'criteria provided, single submitter' or 'no assertion criteria provided' - maps to star ratings via clinvarStarMap), disease object (id: EFO/HP/MONDO disease ID, name: disease/phenotype name), diseaseFromSource (original disease/phenotype text as reported by submitter), studyId (ClinVar RCV accession number linking to ClinVar record), and literature (array of publication IDs: PubMed/PMC identifiers or null). Test data for 19_44908822_C_T: returned 2 submissions - one for 'drug response' (warfarin sensitivity) with RCV000845582 linking to cholesterol embolism (EFO_0005801), another 'benign' classification for Hypercholesterolemia (HP_0003124) with RCV001262472. No fragments to inline. Used in EVA section Body.tsx component with OtTable displaying sortable/filterable columns: Disease/phenotype (shows mapped disease with tooltip for diseaseFromSource and cohortPhenotypes), ClinVar ID (links to NCBI ClinVar with studyId RCV number), Clinical significance (displays clinicalSignificances array with sentence casing), Allele origin (shows alleleOrigins with tooltip for allelicRequirements), Review status (displays confidence as star rating 0-4 stars using ClinvarStars component and clinvarStarMap), and Literature (shows PublicationsDrawer with links to Europe PMC for each literature ID). Data sourced from European Variation Archive (EVA) aggregating ClinVar clinical submissions associating genetic variants to diseases/phenotypes. Section description indicates this shows 'Genetic variation from clinical submissions' from EVA. The variant 1_113761186_C_A was also tested and returned count=0 with empty rows array, confirming query works correctly for variants without EVA evidence."
VariantGWASCredibleSetsSummary,variant,packages/sections/src/variant/GWASCredibleSets/GWASCredibleSetsSummaryFragment.gql,Retrieves the total count of GWAS credible sets associated with a genetic variant. Used to determine if the GWAS Credible Sets section should be displayed on the variant page.,"variant, gwas, credible-sets, count, summary, finemapping",variantId: String! (Example: 19_44908822_C_T),✅ Success,Full results,"Originally a fragment (VariantGWASCredibleSetsSummaryFragment on Variant), converted to standalone query. Query successfully tested with rs7412 variant (19_44908822_C_T), returned count=1102 GWAS credible sets, and with variant 1_113761186_C_A, returned count=278 GWAS credible sets. No pagination - returns only the count field, not the actual credible set data. Response includes variant object with id (variant ID in chr_pos_ref_alt format) and gwasCredibleSets object containing count (integer representing total number of GWAS credible sets where this variant appears). Uses studyTypes filter set to [gwas] to retrieve only GWAS credible sets (excluding QTL credible sets). Used in Summary.tsx component to determine section visibility via hasData function which checks if gwasCredibleSets.count > 0. The summary component uses this minimal query (with page size=1, index=0) to efficiently check data availability without fetching actual credible set rows. The main Body component uses GWASCredibleSetsQuery.gql (not yet extracted) which paginates through actual credible set rows with full details including lead variants, studies, traits, diseases, p-values, beta values, posterior probabilities, fine-mapping methods and confidence, L2G predictions, and credible set sizes. Fragment inlined with id field added for proper query structure. Related to GWASCredibleSetsQuery.gql which provides paginated full credible set details with size=500/batch for the detailed table showing which GWAS studies include this variant in their credible sets."
QTLCredibleSetsSummary,variant,packages/sections/src/variant/QTLCredibleSets/QTLCredibleSetsSummaryFragment.gql,"Retrieves the count of molecular QTL (molQTL) credible sets containing a specific variant across different study types (scsqtl, sceqtl, scpqtl, sctuqtl, sqtl, eqtl, pqtl, tuqtl).","variant, qtl, credible-sets, molqtl, eqtl, pqtl, sqtl, count, summary",variantId: String! (Example: 19_44908822_C_T),✅ Success,Full results,"Originally a fragment (VariantQTLCredibleSetsSummaryFragment on Variant), converted to standalone query. Query successfully tested with variants 19_44908822_C_T (rs7412, returned count=27 QTL credible sets) and 1_113761186_C_A (returned count=7 QTL credible sets). No pagination - returns only the count field, not the actual credible set data. Response includes variant object with qtlCredibleSets object containing count (integer representing total number of molQTL credible sets where this variant appears). Uses studyTypes filter set to [scsqtl, sceqtl, scpqtl, sctuqtl, sqtl, eqtl, pqtl, tuqtl] to retrieve all molecular QTL types including single-cell QTL studies (scsqtl, sceqtl, scpqtl, sctuqtl), splicing QTL (sqtl), expression QTL (eqtl), protein QTL (pqtl), and transcript usage QTL (tuqtl). Used in Summary.tsx component via usePlatformApi to determine section visibility via hasData function which checks if qtlCredibleSets.count > 0. The summary component uses this minimal query (with page size=1, index=0) to efficiently check data availability without fetching actual credible set rows. The main Body component uses QTLCredibleSetsQuery.gql which paginates through actual credible set rows with full details including lead variants, studies, affected genes, tissues/cells, conditions, p-values, beta values, posterior probabilities, fine-mapping methods and confidence, and credible set sizes. Fragment inlined with query wrapper added. Related to QTLCredibleSetsQuery.gql which provides paginated full credible set details with size=500/batch for the detailed table showing which molQTL studies include this variant in their credible sets."
MolecularStructureQuery,variant,packages/sections/src/variant/MolecularStructure/MolecularStructureQuery.gql,Fetches protein coding coordinates and amino acid information for a variant to display molecular structure visualization with 3D protein models.,"variant, molecular structure, protein coding, amino acid, uniprot, 3D visualization, APOE, protein structure, missense variant",variantId: String! (Example: 19_44908822_C_T),✅ Success,Full results,"Query successfully tested with variants 19_44908822_C_T (rs7412, APOE variant) and 1_113761186_C_A. No pagination - returns all protein coding coordinates in single response. For rs7412: returned count=1 with proteinCodingCoordinates containing 1 row with uniprotAccessions [P02649], target ENSG00000130203 (APOE), referenceAminoAcid R, alternateAminoAcid C, aminoAcidPosition 176 (R176C missense variant). For 1_113761186_C_A: returned count=0 with empty rows array, indicating variant does not affect protein coding sequence. Response includes variant object with id, referenceAllele, alternateAllele, and proteinCodingCoordinates object containing count (total number of affected proteins) and rows array. Each row contains: uniprotAccessions (array of UniProt accession IDs for the affected protein), variant object (id field with variant identifier), target object (id: Ensembl gene ID, approvedSymbol: gene symbol), referenceAminoAcid (original amino acid at position), alternateAminoAcid (variant amino acid, ""-"" for synonymous), aminoAcidPosition (position in protein sequence). No fragments to inline. Used in MolecularStructure section Body.tsx component which displays 3D protein structure visualization using the first proteinCodingCoordinates row. Component accesses row[0] for uniprotAccession, target id/approvedSymbol, and creates variantSummary string from referenceAminoAcid + aminoAcidPosition + alternateAminoAcid (e.g., R176C for rs7412). Section only displays when count > 0 and referenceAminoAcid !== ""-"" (excluding synonymous variants). The StructureViewer component uses UniProt accession to fetch 3D protein structure from AlphaFold or PDB and highlights the variant position in the molecular visualization. Clinically relevant example rs7412 (APOE R176C) is a well-characterized variant associated with APOE2 isoform affecting cholesterol metabolism and Alzheimer's disease risk. Related to MolecularStructureSummary fragment (not yet extracted) which provides count for section visibility check."
VariantEffectPredictorSummary,variant,packages/sections/src/variant/VariantEffectPredictor/VariantEffectPredictorSummaryFragment.gql,Retrieves canonical transcript information for a variant to determine if transcript consequences should be displayed in the summary.,"variant, transcript, canonical, consequence, VEP",variantId: String! (Example: 19_44908822_C_T),✅ Success,Full results,"Originally a fragment (VariantEffectPredictorSummaryFragment on Variant), converted to standalone query. Query successfully tested with variants 19_44908822_C_T (rs7412, returned 61 transcript consequences) and 1_113761186_C_A (returned 21 transcript consequences). No pagination - returns all transcript consequences in single response as array. Response includes variant object with transcriptConsequences array where each element contains isEnsemblCanonical (boolean indicating whether this is an Ensembl canonical transcript). Used in Summary.tsx component via usePlatformApi to determine section visibility via hasData function which checks if transcriptConsequences?.length > 0. This minimal query efficiently checks data availability for the Variant Effect Predictor (VEP) section without fetching full transcript consequence details. The section displays predicted effects of variants on gene transcripts including amino acid changes, consequence types (missense, synonymous, etc.), impact ratings, and distances from regulatory features. Fragment inlined with query wrapper and variantId variable added. No nested fragments. Related to VariantEffectPredictorQuery.gql which provides full transcript consequence details including gene symbols, variant consequences, amino acid changes, UniProt accessions, codons, distances from footprints/TSS, impact scores, consequence scores, transcript indices, LOFTEE predictions, SIFT predictions, and PolyPhen predictions for the detailed table display."
VariantEffectPredictorQuery,variant,packages/sections/src/variant/VariantEffectPredictor/VariantEffectPredictorQuery.gql,"Fetches transcript consequences and variant effect predictions for a genetic variant, including predicted functional impacts, amino acid changes, gene targets, and in-silico predictions from SIFT, PolyPhen, and LOFTEE tools.","variant, transcript-consequences, VEP, effect-predictor, amino-acid-change, SIFT, PolyPhen, LOFTEE, consequence-score, impact, missense, biotype, uniprot, distance-from-footprint, distance-from-tss, canonical-transcript",variantId: String! (Example: 19_44908822_C_T),✅ Success,Full results,"Query successfully tested with variants 19_44908822_C_T (rs7412, APOE variant) returned 63 transcript consequences and 1_113761186_C_A returned 21 transcript consequences. No pagination - returns all transcript consequences in single response as array. Response includes variant object with id (variant identifier in chr_pos_ref_alt format), referenceAllele, alternateAllele, and transcriptConsequences array. Each transcript consequence contains: variantConsequences array with consequence type objects (id: Sequence Ontology term like SO:0001583 for missense_variant, label: formatted consequence name), aminoAcidChange (e.g., R176C for rs7412, null for non-coding), uniprotAccessions array (UniProt accession IDs for affected proteins), codons (reference/alternate codon like Cgc/Tgc, null for non-coding), distanceFromFootprint (distance in bp from regulatory footprint, 0 for coding variants), distanceFromTss (distance in bp from transcription start site, negative if downstream), target object (id: Ensembl gene ID, approvedSymbol: gene symbol, biotype: gene type like protein_coding/lncRNA/pseudogene), impact (VEP impact rating: MODIFIER/MODERATE/HIGH/LOW), consequenceScore (numeric score 0-1 representing predicted severity, 0.66 for R176C missense), transcriptIndex (integer for sorting transcripts), transcriptId (Ensembl transcript ID like ENST00000252486), lofteePrediction (Loss-Of-Function Transcript Effect Estimator prediction or null), siftPrediction (SIFT deleterious prediction score or null), polyphenPrediction (PolyPhen-2 pathogenicity prediction or null). Test data for rs7412 (19_44908822_C_T): clinically important APOE variant showed 63 transcript consequences across nearby genes, with the key missense_variant (SO:0001583) in APOE gene (ENSG00000130203) causing R176C amino acid change (Arginine to Cysteine at position 176), codons Cgc/Tgc, impact=MODERATE, consequenceScore=0.66, transcriptId=ENST00000252486, uniprotAccessions=[P02649, A0A0S2Z3D5], distanceFromFootprint=0, distanceFromTss=-3026, with remaining 62 consequences being upstream_gene_variant or downstream_gene_variant modifiers in nearby genes (CBLC, NECTIN2, ZNF296, etc). Most consequences have impact=MODIFIER with consequenceScore=0 and null predictions. Test data for 1_113761186_C_A: returned 21 transcript consequences all of which are downstream_gene_variant or upstream_gene_variant modifiers with no coding impacts (all aminoAcidChange=null, impact=MODIFIER, consequenceScore=0). No fragments to inline - query is standalone. Used in VariantEffectPredictor section Body.tsx component which displays sortable table with columns: Gene (links to target page, shows biotype chip for protein_coding genes, tooltip with canonical transcript ID and UniProt accession IDs), Predicted consequence (shows variant consequence labels as Sequence Ontology links, displays amino acid change chip, tooltip with codon change), Impact (lowercase impact level), Distance from footprint (formatted with commas), and Distance from start site (formatted with commas). Rows are sorted by transcriptIndex field to maintain consistent ordering. Query includes referenceAllele and alternateAllele fields used in Description component. The in-silico prediction fields (lofteePrediction, siftPrediction, polyphenPrediction) are returned but appear to be null in test data - may be populated for other variants. This implements Variant Effect Predictor (VEP) annotations showing how variants affect genes and transcripts."
