query_name,entity_type,source_file,description,keywords,variables,tested_status,pagination_behavior,notes
GwasCredibleSetsQuery,evidence,packages/sections/src/evidence/GWASCredibleSets/sectionQuery.gql,"Retrieves GWAS credible sets evidence linking a target to a disease, including variant information, study details, fine-mapping metrics (method, confidence), statistical measures (p-values, beta), and L2G (locus-to-gene) scores","evidence, gwas, credible-sets, fine-mapping, variants, l2g-score, locus-to-gene, p-value, beta, genetic-association, pagination, cursor","ensemblId: String! (Example: ENSG00000162594 for IL23R), efoId: String! (Example: EFO_0003767 for IBD), size: Int! (Example: 10), cursor: String (optional)",✅ Success,"Paginated (cursor-based, returns count and cursor fields)","Query executes successfully. Tested with IL23R (ENSG00000162594) + inflammatory bowel disease (EFO_0003767), returned count=110 total credible sets. Returns comprehensive GWAS fine-mapping data including studyLocusId, lead variant details (id, chromosome, position, alleles), study metadata (traitFromSource, projectId, publication info, sample size), statistical measures (pValueMantissa/Exponent, beta), fine-mapping details (finemappingMethod like SuSiE-inf, confidence levels like 'SuSiE fine-mapped credible set with out-of-sample LD'), and L2G scores for target-variant linkage prediction. Cursor-based pagination confirmed working. Uses enableIndirect=true to include related disease evidence. Default size in app: 3500 (sectionsBaseSizeQuery). Sample results included credible sets for Crohn's disease, IBD, and ulcerative colitis with L2G scores of 0.95 for the IL23R gene region."
GenomicsEnglandSummaryFragment,evidence,packages/sections/src/evidence/GenomicsEngland/GenomicsEnglandSummaryFragment.gql,Retrieves the count of Genomics England Panel App evidence entries for a target-disease association. Used in the evidence section summary to display the number of available GEL PanelApp entries.,"genomics england, gel panelapp, evidence, count, summary, rare disease, gene panel","efoId: String! (Example: MONDO_0007254), ensgId: String! (Example: ENSG00000141510)",✅ Success,Full results,"Originally a fragment, converted to standalone query. Query successfully tested with TP53 (ENSG00000141510) + MONDO_0007254 (resolves to breast cancer), returned count=2. Also tested with BRAF (ENSG00000157764) + melanoma (EFO_0000756), returned count=0. Uses size=0 parameter to retrieve only count without fetching evidence rows for efficient summary display. Returns total number of Genomics England Panel App evidence entries without pagination. Used by Summary component in GenomicsEngland section to display entry count in format 'X entr(y|ies)'. GEL PanelApp primarily covers rare disease gene panels, so common cancer pairs may return count=0. Datasource ID: genomics_england, uses enableIndirect=true."
GenomicsEnglandQuery,evidence,packages/sections/src/evidence/GenomicsEngland/sectionQuery.gql,"Fetches Genomics England evidence for a target-disease association, including panel information, confidence levels, allelic requirements, cohort phenotypes, and literature references from the Genomics England PanelApp","genomics england, gel panelapp, evidence, gene panel, rare disease, genetic association, allelic requirements, confidence, cohort phenotypes","ensemblId: String! (Example: ENSG00000198947 for DMD), efoId: String! (Example: EFO_0000508), size: Int! (Example: 10)",✅ Success,"Paginated (returns X/page based on size parameter, total varies)","Query executes successfully. Tested with DMD (ENSG00000198947) + cardiomyopathy/genetic disorder (EFO_0000508), returned count=21 with 10 rows retrieved. Includes comprehensive gene panel data: disease mapping (MONDO IDs/names like Duchenne muscular dystrophy MONDO_0010679, Becker muscular dystrophy MONDO_0010311, dilated cardiomyopathy 3B MONDO_0010542), diseaseFromSource (panel names in UPPER CASE or Title Case), cohortPhenotypes arrays (OMIM codes with phenotype names like 'DUCHENNE MUSCULAR DYSTROPHY 310200', 'CARDIOMYOPATHY DILATED X-LINKED TYPE 3B 302045'), confidence levels (green/amber/red classification from GEL PanelApp), allelicRequirements (inheritance patterns like 'X-LINKED: hemizygous mutation in males, biallelic mutations in females'), studyOverview (panel categories like 'DDG2P', 'Paediatric or syndromic cardiomyopathy', 'Limb girdle muscular dystrophies, myofibrillar myopathies and distal myopathies'), studyId (panel identifiers like '484', '285', '749'), and literature arrays with PMID references (can be null). Genomics England specializes in rare disease gene panels curated for NHS clinical diagnostics and has sparse coverage for common cancers (BRAF+melanoma returns count=0). Uses standard pagination with size parameter and returns count field for total available rows. enableIndirect=true allows related disease matches. Related to GenomicsEnglandSummaryFragment.gql which fetches only count for summary display."
GeneBurdenSummaryFragment,evidence,packages/sections/src/evidence/GeneBurden/GeneBurdenSummary.gql,"Retrieves the count of Gene Burden evidence entries for a target-disease association. Used to display summary statistics showing the number of genetic burden evidence from studies like Genebass, Epi25, SCHEMA consortium.","gene burden, evidence, count, summary, fragment, genebass, epi25, schema, genetic-association","ensgId: String! (Example: ENSG00000144285 for SCN1A), efoId: String! (Example: EFO_0000474 for epilepsy)",✅ Success,Full results,"Originally a fragment, converted to standalone query. Query successfully tested with SCN1A (ENSG00000144285) + epilepsy (EFO_0000474), returned count=1. Also tested with BRAF (ENSG00000157764) + melanoma (EFO_0000756), returned count=0. Uses size=0 parameter to retrieve only count without fetching evidence rows for efficient summary display. Returns total number of Gene Burden evidence entries without pagination. Used by Summary component in GeneBurden section to display entry count. Gene burden data comes from rare variant burden studies (Genebass, Epi25 collaborative, Autism Sequencing Consortium, SCHEMA consortium, AstraZeneca PheWAS Portal) and is more common for neurodevelopmental/neurological diseases. Datasource ID: gene_burden, uses enableIndirect=true."
GeneBurdenQuery,evidence,packages/sections/src/evidence/GeneBurden/GeneBurdenQuery.gql,"Retrieves gene burden evidence for a target-disease association, including rare variant burden analysis data with statistical measures (p-values, odds ratios, beta values), cohort information, ancestry, and allelic requirements from studies like Genebass, Epi25, SCHEMA consortium","gene burden, evidence, rare variant, burden analysis, odds ratio, beta, p-value, cohort, ancestry, allelic requirements, pagination","ensemblId: String!, efoId: String!, size: Int! (Example: 3500 from sectionsBaseSizeQuery)",✅ Success,"Paginated (uses size parameter, returns count and rows fields)","Query executes successfully with valid syntax. Tested with BRAF (ENSG00000157764) + melanoma (EFO_0000756), returned count=0 indicating sparse data coverage. Gene burden data is more common for neurodevelopmental/neurological diseases (epilepsy, autism, schizophrenia) from sources like Genebass, Epi25 collaborative, Autism Sequencing Consortium, SCHEMA consortium, and AstraZeneca PheWAS Portal. Returns comprehensive burden test data including studyId, cohortId/projectId (e.g., Epi25, Genebass), ancestry/ancestryId, statistical methods (model), allelicRequirements (inheritance patterns), sample statistics (studyCases, studyCasesWithQualifyingVariants, studySampleSize), effect sizes (oddsRatio with 95% CI, beta with 95% CI), p-values (mantissa/exponent format), directionOnTrait/variantEffect for direction of effect analysis, targetFromSourceId, and literature PMIDs. Uses standard pagination with size parameter (default 3500 in app from sectionsBaseSizeQuery constant). enableIndirect=true to include related diseases. Related to GeneBurdenSummaryFragment.gql which fetches only count for summary display. OtTable component provides client-side pagination/filtering of results."
IntOgenQuery,evidence,packages/sections/src/evidence/IntOgen/sectionQuery.gql,"Fetches IntOGen cancer driver evidence for a target-disease pair, including mutation data, driver methods, cohort information, and the target's role in cancer from hallmarks data.","intogen, cancer, somatic mutation, driver genes, cohort, hallmarks, evidence","ensemblId: String! (Example: ENSG00000157764), efoId: String! (Example: EFO_0000756), size: Int! (Example: 3500)",✅ Success,"Paginated (batch: 3500/page, may auto-fetch all)","Query executes successfully. Tested with BRAF (ENSG00000157764) + melanoma (EFO_0000756), returned count=8 with complete data for 8 cohorts including TCGA_WXS_MEL (227 mutated samples), HARTWIG_WGS_SKCM_2023 (152 samples), and CBIOP_WXS_CM_VALLEN_2018 (70 samples). Each row includes disease mapping (melanoma, cutaneous melanoma), diseaseFromSource (e.g., 'Melanoma', 'Cutaneous Melanoma'), target approvedSymbol (BRAF), mutatedSamples with functional consequences (gain_of_function_variant SO:0002053), numberSamplesTested/numberMutatedSamples counts, resourceScore (combined p-values ranging from 1.4e-61 to 5.1e-7), significantDriverMethods arrays (oncodrivefml, oncodriveclustl, dndscv, smregions, cbase, mutpanning, hotmaps), and cohort information (cohortId, cohortShortName, cohortDescription). Target hallmarks section returns role in cancer ('oncogene'), fusion partners (TIF1A, TRIM4, SND1), function summary (serine/threonine kinase in RAS-ERK pathway), impact of V600E mutation (kinase hyperactivity), and literature PMIDs. Uses standard pagination with size parameter (default 3500 from sectionsBaseSizeQuery constant). enableIndirect=true includes related disease evidence. IntOGen specializes in cancer driver genes from somatic point mutations. Query makes parallel requests to both disease.evidences and target.hallmarks endpoints to combine evidence and target characterization data."
OTEncoreSummaryFragment,evidence,packages/sections/src/evidence/OTEncore/OTEncoreSummary.gql,Retrieves the count of OT Encore evidence entries for a target-disease association. Used to display summary statistics showing the number of evidence entries from the Encore datasource (Open Targets partner data).,"encore, evidence, partner-data, ot-partner, count, summary, fragment, otar","efoId: String! (Example: EFO_0000756), ensgId: String! (Example: ENSG00000157764)",✅ Success,Full results,"Originally a fragment, converted to standalone query. Query successfully tested with BRAF (ENSG00000157764) + melanoma (EFO_0000756), returned count=0. Also tested with TNF (ENSG00000232810) + rheumatoid arthritis (EFO_0000685), returned count=0. Uses size=0 parameter to retrieve only count without fetching evidence rows for efficient summary display. Returns total number of OT Encore evidence entries without pagination. OT Encore is a private/partner datasource with restricted data availability, marked in UI as 'OT Partner' data type. Part of Public-Private Partnership (PPP) program evidenced by partnerDataSources=['encore'] in platform profile configs. Used by Summary component in OTEncore section to display entry count. enableIndirect=true to include indirect evidence associations. datasourceIds=['encore'] targets the Encore private partner data. Sparse data coverage - tests indicate limited availability even for well-studied pairs. Related to potential full OTEncore section query (not found in codebase) which would fetch detailed evidence records similar to other evidence sources."
OTCrisprQuery,evidence,packages/sections/src/evidence/OTCRISPR/OTCrisprQuery.gql,"Fetches Open Targets CRISPR evidence data for a target-disease pair, including cell line information, fold changes, and significance scores from CRISPR screens","evidence, crispr, ot_crispr, cell-lines, fold-change, significance, target-disease, otar","ensemblId: String! (Example: ENSG00000157764), efoId: String! (Example: EFO_0000756), size: Int! (Example: 10)",✅ Success,"Paginated (returns X/page based on size parameter, total varies)","Query executes successfully with valid syntax and returns proper response structure with count and rows fields. Tested with BRAF (ENSG00000157764) + melanoma (EFO_0000756), returned count=0 indicating sparse data coverage - OT CRISPR is private/partner data with limited availability. Uses standard offset-based pagination with size parameter (default from sectionsBaseSizeQuery constant). Returns comprehensive CRISPR screening data including disease mapping (id, name), projectId (OTAR project codes linking to home.opentargets.org), contrast (experimental conditions), studyOverview (study descriptions), cellType, cellLineBackground (cell line genetic context), crisprScreenLibrary (library used), statisticalTestTail, resourceScore (significance measure), log2FoldChangeValue (effect size), diseaseCellLines array with names (cancer cell lines tested), and releaseVersion. enableIndirect=true to include related disease evidence. datasourceIds=['ot_crispr'] targets Open Targets CRISPR data. Related to OTCrisprSummary.gql fragment which fetches only count for summary display. Evidence from CRISPR knockout screens identifying essential genes in disease-relevant cell lines."
OrphanetSummaryFragment,evidence,packages/sections/src/evidence/Orphanet/OrphanetSummaryFragment.gql,Retrieves the count of Orphanet evidence entries for a target-disease association. Used to display summary statistics showing the number of rare disease genetic association evidence from the Orphanet datasource.,"orphanet, evidence, rare-disease, genetic-association, count, summary, fragment","ensgId: String! (Example: ENSG00000198947), efoId: String! (Example: EFO_0000508)",✅ Success,Full results,"Originally a fragment, converted to standalone query. Query successfully tested with BRAF (ENSG00000157764) + melanoma (EFO_0000756), returned count=0. Also tested with DMD (ENSG00000198947) + cardiomyopathy (EFO_0000508), returned count=5 with Orphanet evidence for Duchenne muscular dystrophy, Becker muscular dystrophy, familial isolated dilated cardiomyopathy, X-linked non-syndromic intellectual disability, and symptomatic form of muscular dystrophy in female carriers. Uses size=0 parameter to retrieve only count without fetching evidence rows for efficient summary display. Returns total number of Orphanet evidence entries without pagination. Orphanet specializes in rare disease gene-phenotype associations with confidence levels (Assessed) and literature PMIDs. Common cancer associations typically return count=0 as Orphanet focuses on rare diseases. Uses enableIndirect=true to include related disease evidence. Used by Summary component in Orphanet section to display entry count format 'X entr(y|ies)'. Related to full OrphanetQuery.gql which fetches detailed evidence including disease mappings, variantEffect, directionOnTrait, alleleOrigins, variantFunctionalConsequence, and confidence levels with pagination support (size parameter)."
OTValidationSummaryFragment,evidence,packages/sections/src/evidence/OTValidation/OTValidationSummary.gql,Retrieves the count of OT CRISPR Validation evidence entries for a target-disease association from the Open Targets Validation Lab. Used by the Summary component to display evidence count without loading full evidence details.,"ot_crispr_validation, validation lab, otvl, evidence, count, summary, fragment, ot-partner, otar, cell-lines, biomarkers, assays","efoId: String! (Example: EFO_0000756), ensgId: String! (Example: ENSG00000157764)",✅ Success,Full results,"Originally a fragment, converted to standalone query. Query successfully tested with BRAF (ENSG00000157764) + melanoma (EFO_0000756), returned count=0. Also tested with TP53 (ENSG00000141510) + breast cancer (MONDO_0007254), returned count=0. Uses size=0 parameter to retrieve only count without fetching evidence rows for efficient summary display. Returns total number of OT CRISPR Validation evidence entries without pagination. OT CRISPR Validation is a private/partner-only datasource from Open Targets Partner Programme with restricted data availability (isPrivate: true), marked in UI as 'Partner-only' data type. Part of Public-Private Partnership (PPP) program with docsLink to partner-platform.opentargets.org/projects. Uses enableIndirect=true to include indirect evidence associations. datasourceIds=['ot_crispr_validation'] targets the Open Targets Validation Lab data showing experimental validation of target-disease associations through CRISPR screens. Used by Summary component in OTValidation section to display entry count format 'X entr(y|ies)'. Related to OTValidationQuery.gql (ValidationQuery) which fetches full evidence details including disease info, projectId, studyOverview, diseaseCellLines (with id/name/tissue/tissueId), biomarkerList (name/description), primaryProjectId, primaryProjectHit (boolean), assays array (description/isHit/shortName for CellTiterGlo/CellTox/Cell Confluence), assessments array, resourceScore, and releaseVersion with pagination support (size parameter). Query structure validated - returns proper count field in response."
OrphanetQuery,evidence,packages/sections/src/evidence/Orphanet/OrphanetQuery.gql,"Fetches detailed Orphanet evidence for a target-disease pair, including rare disease genetic associations with disease mappings, variant effects, directionality, allele origins, functional consequences, and confidence levels. Returns paginated evidence records from the Orphanet datasource.","orphanet, evidence, rare-disease, genetic-association, variant-effect, allele-origins, functional-consequence, confidence, pagination, section","ensemblId: String! (Example: ENSG00000198947), efoId: String! (Example: EFO_0000508), size: Int! (Example: 10)",✅ Success,"Paginated (returns X/page based on size parameter, total count varies)","Query successfully tested with BRAF (ENSG00000157764) + melanoma (EFO_0000756), returned count=0 (expected - Orphanet focuses on rare diseases). Also tested with DMD (ENSG00000198947) + genetic disorder (EFO_0000508), returned count=5 with complete evidence records including target (id, approvedSymbol), disease (id, name), variantEffect (null in test), directionOnTrait (risk), diseaseFromSource (Duchenne muscular dystrophy, Becker muscular dystrophy, etc.), diseaseFromSourceId (Orphanet_98896, Orphanet_98895, etc.), diseaseFromSourceMappedId (MONDO IDs and EFO IDs), targetFromSource (dystrophin), targetFromSourceId (ENSG00000198947), alleleOrigins ([germline]), confidence (Assessed), literature (PMIDs: 23900271, 14567970, 20301486), and variantFunctionalConsequence (null in test). Uses standard offset-based pagination with size parameter controlling rows per page. Returns count field showing total available evidence and rows array with paginated results. Query structure includes enableIndirect=true to include related disease evidence and datasourceIds=['orphanet'] to target Orphanet data specifically. Related to OrphanetSummaryFragment.gql which fetches only count (with size=0) for efficient summary display in section header. Orphanet specializes in rare/genetic disease gene-phenotype associations with curated confidence levels and literature references. Common cancer or non-rare disease associations typically return count=0."
ValidationQuery,evidence,packages/sections/src/evidence/OTValidation/OTValidationQuery.gql,"Fetches Open Targets CRISPR validation lab evidence for a target-disease pair, including cell line data, biomarkers, assay results, and project assessments. Returns detailed experimental validation data from the OT Validation Lab.","evidence, ot_crispr_validation, validation lab, CRISPR, cell lines, biomarkers, assays, OTAR, otvl, cell-titer-glo, celltox, confluence, primary-project, assessments","ensemblId: String! (Example: ENSG00000157764), efoId: String! (Example: EFO_0000756), size: Int! (Example: 3500)",✅ Success,"Paginated (returns X/page based on size parameter, total varies)","Query executes successfully with valid syntax and returns proper response structure with count and rows fields. Tested with BRAF (ENSG00000157764) + melanoma (EFO_0000756) and TP53 (ENSG00000141510) + rheumatoid arthritis (EFO_0000685), both returned count=0 indicating sparse data coverage - OT CRISPR Validation is a private/partner datasource from Open Targets Partner Programme with restricted availability. Uses standard offset-based pagination with size parameter (default sectionsBaseSizeQuery=3500). Returns comprehensive validation lab data including disease info (id, name), projectId (OTAR project identifier), studyOverview (study description), diseaseCellLines array (id/name/tissue/tissueId for cancer cell lines tested), resourceScore (effect size metric), biomarkerList array (name/description of cell line biomarkers like BRAF_mut, KRAS_mut), releaseVersion, primaryProjectId (links to home.opentargets.org OTAR projects), primaryProjectHit (boolean indicating if gene was hit in primary screen), assessments array (OTVL assessment conclusions), and assays array (description/isHit/shortName for CellTiterGlo/CellTox/Cell Confluence viability/toxicity assays). enableIndirect=true includes related disease evidence. datasourceIds=['ot_crispr_validation'] targets OT Validation Lab data. Related to OTValidationSummary.gql fragment which fetches only count for summary display. Evidence from CRISPR knockout screens validating therapeutic target hypotheses in disease-relevant cell lines. Query structure identical to ValidationQuery name in source file."
ProgenyQuery,evidence,packages/sections/src/evidence/Progeny/sectionQuery.gql,"Fetches PROGENy pathway activity evidence for a target-disease association, including significant pathways and p-values. PROGENy (Pathway RespOnsive GENes) provides evidence from pathway perturbation experiments.","progeny, evidence, pathway-activity, affected-pathway, reactome, p-value, section","ensemblId: String! (Example: ENSG00000157764), efoId: String! (Example: EFO_0000756), size: Int! (Example: 3500)",✅ Success,Paginated (batch: 3500/page by default),"Query successfully tested with BRAF (ENSG00000157764) + melanoma (EFO_0000756), returned count=0. Also tested with TP53 (ENSG00000141510) + breast cancer (EFO_0000305), returned count=1 with evidence for breast adenocarcinoma showing pathway 'p53-Dependent G1 DNA damage Response' (R-HSA-69563) with p-value 4.89e-50. Uses size-based limiting (not cursor/offset pagination) where size parameter controls maximum number of rows returned. Default size is 3500 (sectionsBaseSizeQuery constant). Returns count field showing total matches and rows array with evidence. Query uses enableIndirect=true to include indirect disease associations and datasourceIds=['progeny'] to filter to PROGENy data source. Response includes disease (id, name), diseaseFromSource (original disease code), pathways array (id, name for Reactome pathways), and resourceScore (p-value in scientific notation). PROGENy data appears sparse/selective in database - not all target-disease pairs have evidence. Related to ProgenySummary.gql fragment which fetches only count for summary display. No fragments to inline - self-contained query."
ProgenySummaryFragment,evidence,packages/sections/src/evidence/Progeny/ProgenySummary.gql,Retrieves the count of PROGENy pathway evidence entries for a target-disease association. Used by Summary component to display evidence count without loading full evidence details. PROGENy provides pathway perturbation experiment evidence.,"progeny, evidence, pathway-activity, count, summary, fragment","ensemblId: String! (Example: ENSG00000157764), efoId: String! (Example: EFO_0000756)",✅ Success,Full results,"Originally a fragment, converted to standalone query. Query successfully tested with BRAF (ENSG00000157764) + melanoma (EFO_0000756), returned count=0. Also tested with TP53 (ENSG00000141510) + breast cancer (EFO_0000305), returned count=1. Uses size=0 parameter to retrieve only count without fetching evidence rows for efficient summary display. Returns total number of PROGENy pathway evidence entries without pagination. Uses enableIndirect=true to include indirect evidence associations. datasourceIds=['progeny'] targets PROGENy pathway activity data. Used by Summary component in Progeny section to display entry count. Related to full ProgenyQuery (sectionQuery.gql) which fetches detailed evidence including pathways, diseaseFromSource, and p-values with pagination support (size parameter defaults to 3500). PROGENy data coverage is sparse - only available for select target-disease pairs with pathway perturbation evidence."
