query_name,entity_type,source_file,description,keywords,variables,tested_status,pagination_behavior,notes
TargetAssociationsQuery,target,apps/platform/src/pages/TargetPage/TargetAssociations/TargetAssociationsQuery.gql,"Fetches paginated, filtered, and sorted disease associations for a specific target gene","target, disease, associations, pagination, filtering, scoring","id: String!, index: Int!, size: Int!, sortBy: String!, enableIndirect: Boolean!, datasources: [DatasourceSettingsInput!], rowsFilter: [String!], facetFilters: [String!], entitySearch: String!",✅ Success,"Paginated (returns 25/page, total varies)",Query executes successfully. Returns count=1555 for BRAF. Empty rows may require specific datasource configuration.
TargetPageQuery,target,apps/platform/src/pages/TargetPage/TargetPage.gql,"Fetches basic target information including identifiers, names, protein IDs, and cross-references","target, gene, identifiers, protein, cross-references, uniprot, ensembl",ensgId: String!,✅ Success,Full results,"Query executes successfully. Returns complete target data for BRAF including 33 protein IDs and extensive dbXrefs (PDB, DrugBank, Reactome, InterPro, ProjectScore)."
TargetProfileHeaderQuery,target,apps/platform/src/pages/TargetPage/TargetProfileHeader.gql,"Fetches target profile header information including synonyms, function descriptions, essentiality, and genomic location","target, gene, synonyms, function, genomic-location, essential-gene, profile",ensgId: String!,✅ Success,Full results,"Originally a fragment, converted to standalone query. Returns 24 synonyms, function descriptions, isEssential status, and genomic location for BRAF on Chr7."
DiseaseAssociationsQuery,disease,apps/platform/src/pages/DiseasePage/DiseaseAssociations/DiseaseAssociationsQuery.gql,"Fetches paginated, filtered, and sorted target associations for a specific disease","disease, target, associations, pagination, filtering, scoring, prioritization","id: String!, index: Int!, size: Int!, sortBy: String!, enableIndirect: Boolean!, datasources: [DatasourceSettingsInput!], rowsFilter: [String!], facetFilters: [String!], entitySearch: String!",✅ Success,"Paginated (returns 25/page, total varies)",Query executes successfully. Returns count=2961 for rheumatoid arthritis. Empty rows may require specific datasource configuration.
DiseasePageQuery,disease,apps/platform/src/pages/DiseasePage/DiseasePage.gql,"Fetches basic disease information including ID, name, and cross-references","disease, identifiers, cross-references, efo, ontology",efoId: String!,✅ Success,Full results,"Query executes successfully. Returns comprehensive dbXRefs for rheumatoid arthritis including SNOMEDCT, UMLS, OMIM, ICD codes, MESH, and more."
DiseaseProfileHeaderQuery,disease,apps/platform/src/pages/DiseasePage/ProfileHeader.gql,Fetches disease profile header information including description and synonyms,"disease, description, synonyms, profile, ontology",efoId: String!,✅ Success,Full results,"Originally a fragment, converted to standalone query. Returns detailed description and synonym groups with different relations (exact, related, narrow, broad)."
DrugPageQuery,drug,apps/platform/src/pages/DrugPage/DrugPage.gql,"Fetches basic drug information including ChEMBL ID, name, and cross-references","drug, chembl, identifiers, cross-references, molecule",chemblId: String!,✅ Success,Full results,Query executes successfully. Returns drug data including name (TRASTUZUMAB) and cross-references to EMA and DailyMed.
DrugProfileHeaderQuery,drug,apps/platform/src/pages/DrugPage/ProfileHeader.gql,"Fetches comprehensive drug profile information including type, synonyms, approval status, safety warnings, and clinical data","drug, chembl, molecule, approval, clinical-trial, safety, synonyms, trade-names",chemblId: String!,✅ Success,Full results,"Originally a fragment, converted to standalone query. Returns rich data for TRASTUZUMAB including 51 synonyms, approved status (1998), black box warning, phase 4 trials, and trade names."
VariantProfileHeaderQuery,variant,apps/platform/src/pages/VariantPage/ProfileHeader.gql,"Fetches variant profile information including coordinates, alleles, frequencies, and consequence predictions","variant, snp, allele, frequency, consequence, genomics, mutation",variantId: String!,✅ Success,Full results,"Originally a fragment, converted to standalone query. Successfully re-verified on 2025-11-19 with valid variant ID 19_44908822_C_T (rs7412 APOE variant). Returns complete variant header data including chromosome 19, position 44908822, reference allele C, alternate allele T, allele frequencies across populations, and variant consequences."
VariantPageQuery,variant,apps/platform/src/pages/VariantPage/VariantPage.gql,"Fetches basic variant information including ID, coordinates, alleles, and cross-references","variant, snp, genomics, coordinates, allele, cross-references",variantId: String!,✅ Success,Full results,"Query executes successfully. Re-verified 2025-11-19 with valid variant ID 19_44908822_C_T (APOE variant). Returns variant ID, 8 cross-references (ensembl_variation rs7412, clinvar VCV000441266/265/262/17848, protvar, omim, gnomad), chromosome 19, position 44908822, reference allele C, alternate allele T. Original test ID (1_55039974_G_A) was non-existent in database."
StudyPageQuery,study,apps/platform/src/pages/StudyPage/StudyPage.gql,"Fetches core study information including study metadata, background traits, associated target, and diseases for a given study.","study, metadata, background traits, target, diseases, gwas, qtl, genetics",studyId: String!,✅ Success,Full results,"Query successfully tested with GCST90002357, returning study ID, study type (gwas), project ID (GCST), background traits, target, and associated diseases (platelet count)."
StudyProfileHeaderQuery,study,apps/platform/src/pages/StudyPage/StudyProfileHeader.gql,"Fetches comprehensive study profile information including publication details, sample statistics, quality controls, and study-specific metadata for display in the Study Profile Header component.","study, profile, publication, sample size, quality control, GWAS, QTL, biosample",studyId: String!,✅ Success,Full results,"Originally a fragment (StudyProfileHeaderFragment), converted to standalone query. Query successfully tested with GCST90002357, returning complete data including 19 cohorts, 6 QC check values, and metadata for a GWAS study on platelet count."
EvidencePageQuery,evidence,apps/platform/src/pages/EvidencePage/EvidencePageQuery.gql,"Fetches basic target and disease information for the evidence page header, used to display context when viewing target-disease evidence relationships","evidence, target, disease, header, identifiers","ensgId: String!, efoId: String!",✅ Success,Full results,"Query executes successfully. Tested with BRAF (ENSG00000157764) + rheumatoid arthritis (EFO_0000685), and TP53 (ENSG00000141510) + breast cancer (MONDO_0007254). Both tests returned correct target symbols and disease names."
CredibleSetPageQuery,credibleset,apps/platform/src/pages/CredibleSetPage/CredibleSetPage.gql,Fetches basic credible set information including variant details and associated study information for a given study locus,"credible-set, variant, study, gwas, fine-mapping, locus",studyLocusId: String!,✅ Success,Full results,"Query successfully tested with 7d68cc9c70351c9dbd2a2c0c145e555d. Returns complete credible set data including variant ID (1_113761186_C_A), alleles, study ID (GCST90132222), and study type (gwas)."
SearchPageQuery,search,apps/platform/src/pages/SearchPage/SearchPageQuery.gql,"Multi-entity search query that returns paginated search results across targets, diseases, drugs, variants, and studies. Also fetches the top hit for each entity type to display as a detail panel.","search, pagination, multi-entity, aggregation, variant, study, target, disease, drug, highlights","queryString: String!, index: Int!, entityNames: [String!]!",✅ Success,Paginated (returns 10/page fixed),"Query executes successfully. Tested with queryString='BRAF', returned 1,239 total results with aggregations showing disease (1,205), study (111), drug (27), and target (7) hits. Top hit correctly returns most relevant BRAF target."
CredibleSetProfileHeaderFragment,credibleset,apps/platform/src/pages/CredibleSetPage/ProfileHeader.gql,"Fetches comprehensive credible set profile information including statistical measures (p-values, beta, standard error), fine-mapping details, variant information, and associated study metadata","credible-set, fine-mapping, locus, variant, gwas, qtl, study, statistical-measures, p-value, beta, posterior-probability, profile",variantIds: [String!],✅ Success,Full results,"Re-verified 2025-11-19 with valid credible set ID 7d68cc9c70351c9dbd2a2c0c145e555d. Query returns complete credible set data including p-values (1.27e-168), beta (0.037), purity R2 (0.988), finemappingMethod (SuSiE-inf), variant info (rs6679677 on Chr1), study metadata (Rheumatoid arthritis GWAS with 276k samples), quality controls, confidence scores, and locus data (count=2). Original test ID was non-existent in database."
GWASColocQuery,credibleset,apps/platform/src/pages/APIPage/CredibleSetAnnotation.gql,"Retrieves colocalization metrics for GWAS credible sets, including overlapping study loci, variant information, and statistical measures for assessing variant colocalization.","credible set, colocalization, GWAS, coloc, h3, h4, clpp, betaRatioSignAverage",studyLocusId: String (Example: 7d68cc9c70351c9dbd2a2c0c145e555d),✅ Success,"Paginated (batch: 500/page, may auto-fetch all)","Query successfully tested with 7d68cc9c70351c9dbd2a2c0c145e555d. Returns 502 colocalization results with complete metrics including otherStudyLocus, variant details, colocalization methods (COLOC, eCAVIAR), statistical measures (h3, h4, clpp, betaRatioSignAverage), and colocalization variant counts."
GWASColocSummaryFragment,credibleset,packages/sections/src/credibleSet/GWASColoc/GWASColocSummaryFragment.gql,Fragment that fetches GWAS colocalization summary count for a credible set. Returns the total number of GWAS studies that colocalize with the given credible set.,"credible set, colocalization, GWAS, summary, count",studyLocusId: String! (Example: 7d68cc9c70351c9dbd2a2c0c145e555d),✅ Success,Full results,"Originally a fragment, converted to standalone query. Query successfully tested with 7d68cc9c70351c9dbd2a2c0c145e555d. Returns count=502 GWAS colocalizations. Used by Summary component in GWASColoc section to display colocalization summary statistics."
Locus2GeneQuery,credibleset,packages/sections/src/credibleSet/Locus2Gene/Locus2GeneQuery.gql,"Fetches locus-to-gene predictions for a credible set, including SHAP-based feature importance scores and target genes with prediction scores","credibleset, locus-to-gene, l2g, shap, feature-importance, fine-mapping, prediction, machine-learning",studyLocusId: String!,✅ Success,Full results,"Query executes successfully. Tested with studyLocusId='7d68cc9c70351c9dbd2a2c0c145e555d', returned count=3 predictions for PTPN22, PHTF1, and RSBN1. Each prediction includes shapBaseValue, 27 feature scores (eQTL/pQTL/sQTL coloc, distance metrics, VEP scores, gene counts), overall score, and target gene information. No pagination - returns all predictions."
MolQTLColocSummaryFragment,credibleset,packages/sections/src/credibleSet/MolQTLColoc/MolQTLColocSummaryFragment.gql,"Fragment that fetches molecular QTL colocalization summary count for a credible set. Returns the total number of molecular QTL studies (scsqtl, sceqtl, scpqtl, sctuqtl, sqtl, eqtl, pqtl, tuqtl) that colocalize with the given credible set.","credible set, colocalization, molecular QTL, molqtl, summary, count, fragment, eqtl, pqtl, sqtl",studyLocusId: String!,✅ Success,Full results,"Originally a fragment, converted to standalone query. Query successfully tested with studyLocusId=7d68cc9c70351c9dbd2a2c0c145e555d. Returns count=14 molecular QTL colocalizations across study types (scsqtl, sceqtl, scpqtl, sctuqtl, sqtl, eqtl, pqtl, tuqtl). Used by Summary component in MolQTLColoc section to display summary statistics. Uses fixed page size of 1 since only count is needed."
Locus2GeneQueryFragment,credibleset,packages/sections/src/credibleSet/Locus2Gene/Locus2GeneQueryFragment.gql,Fetches locus-to-gene predictions count for a credible set summary display. Used by the Summary component to show the number of L2G predictions without loading the full prediction data.,"credibleset, locus-to-gene, l2g, count, summary, fine-mapping",studyLocusId: String!,✅ Success,Full results,"Originally a fragment, converted to standalone query. Query successfully tested with 7d68cc9c70351c9dbd2a2c0c145e555d, returned count=3. Lightweight query for summary display, returns only the count of L2G predictions. Full prediction details are fetched by Locus2GeneQuery.gql when section is expanded."
MolQTLColocQuery,credibleset,packages/sections/src/credibleSet/MolQTLColoc/MolQTLColocQuery.gql,"Retrieves paginated molecular QTL colocalization data for a credible set, including study details (pQTL, eQTL, sQTL, etc.), lead variants, statistical metrics (H3, H4, CLPP), and directionality information","credible set, colocalization, molecular QTL, pqtl, eqtl, sqtl, molqtl, coloc, h3, h4, clpp, directionality, section, pagination","studyLocusId: String!, size: Int!, index: Int!",✅ Success,"Paginated (uses page parameter with size and index, returns count field)","Query successfully tested with studyLocusId=7d68cc9c70351c9dbd2a2c0c145e555d, size=10, index=0. Returns count=14 molecular QTL colocalization results across study types [scsqtl, sceqtl, scpqtl, sctuqtl, sqtl, eqtl, pqtl, tuqtl]. Includes trans-QTL flag, target/biosample information, colocalization methods (COLOC/eCAVIAR), and beta ratio sign average for directionality."
VariantsQuery,credibleset,packages/sections/src/credibleSet/Variants/VariantsQuery.gql,"Fetches paginated variants within a credible set, including variant details, statistical measures (p-values, beta, standard error), fine-mapping metrics (posterior probability, log Bayes Factor), linkage disequilibrium, and variant consequences for display in a sortable table.","credible set, variants, fine-mapping, posterior probability, log Bayes Factor, p-value, beta, standard error, linkage disequilibrium, r2, variant consequence, pagination","studyLocusId: String!, size: Int!, index: Int!",✅ Success,"Paginated (uses page parameter with size and index, returns count field)","Query successfully tested with studyLocusId=7d68cc9c70351c9dbd2a2c0c145e555d. Returns count=2 variants total. Uses standard pagination with page.size and page.index parameters. Returns lead variant info separately at top level and paginated locus variants with full statistical details including logBF, posteriorProbability, beta, standardError, r2Overall, and mostSevereConsequence."
VariantsSummaryFragment,credibleset,packages/sections/src/credibleSet/Variants/VariantsSummaryFragment.gql,"Fragment that fetches variant count summary for a credible set locus, both filtered by specific variant IDs and total locus size. Returns counts for both filtered and unfiltered variant sets.","credible set, variants, locus, summary, count, fragment, filter","studyLocusId: String!, variantIds: [String!]",✅ Success,Full results,"Originally a fragment, converted to standalone query. Query successfully tested with studyLocusId=7d68cc9c70351c9dbd2a2c0c145e555d. Returns locus.count=2 (filtered, when variantIds empty) and locusSize.count=2 (total). Tested with variantIds=['1_113761186_C_A'] returns locus.count=1. Used by Summary component in Variants section to display variant count statistics. Uses dual locus calls: one for optional filtering and one for total size."
OTProjectsQuery,disease,packages/sections/src/disease/OTProjects/OTProjectsQuery.gql,"Retrieves Open Targets projects associated with a disease, including project codes, status, names, references, and PPP integration flags","disease, open targets, projects, otar, ppp, active-projects, closed-projects",efoId: String!,✅ Success,Full results,"Query executes successfully. Tested with EFO_0000685 (rheumatoid arthritis), returned empty array (expected for diseases without OT projects). Returns all otarProjects with otarCode, status, projectName, reference, and integratesInPPP fields. No pagination - returns complete list."
DiseaseBibliography,disease,packages/sections/src/disease/Bibliography/BibliographySummaryFragment.gql,"Fetches literature occurrence counts for a disease, providing total count and filtered count for summary display in the Bibliography section.","disease, bibliography, literature, count, publications, summary, fragment",efoId: String!,✅ Success,Full results,"Originally a fragment, converted to standalone query. Query successfully tested with EFO_0000685 (rheumatoid arthritis). Returns literatureOcurrences with count=5792 and filteredCount=5792. Used by Summary component to display publication count in section header. Simple count query without pagination or detailed results."
OntologyQuery,disease,packages/sections/src/disease/Ontology/OntologyQuery.gql,"Retrieves disease ontology information including the disease itself, its parents, ancestors, and children with their therapeutic area flags","disease, ontology, hierarchy, parents, children, ancestors, therapeutic-area",efoId: String!,✅ Success,Full results,"Query executes successfully. Returns the disease with 4 parents, 14 resolved ancestors, and 5 children for rheumatoid arthritis (EFO_0000685). No pagination - returns complete ontology tree."
OTProjectsSummaryFragment,disease,packages/sections/src/disease/OTProjects/OTProjectsSummaryFragment.gql,Fragment that fetches OTAR project codes for a disease to display count in summary. Returns just project codes used to calculate project count in Summary component.,"disease, open targets, projects, otar, summary, count, fragment",efoId: String!,✅ Success,Full results,"Originally a fragment, converted to standalone query. Query structurally valid and executes successfully. Tested with EFO_0000685 (rheumatoid arthritis) and MONDO_0004975, both returned empty arrays (expected - OTAR projects are private/restricted data). Returns array of otarProjects with otarCode field. Used by Summary component to display project count. No pagination - returns complete list. Related to full query OTProjectsQuery.gql which includes additional fields (status, projectName, reference, integratesInPPP)."
OntologySummaryFragment,disease,packages/sections/src/disease/Ontology/OntologySummaryFragment.gql,Summary fragment for disease ontology information including therapeutic area classification,"disease, ontology, therapeutic-area, summary, fragment",efoId: String!,✅ Success,Full results,"Originally a fragment, converted to standalone query. Query successfully tested with EFO_0000685 (rheumatoid arthritis). Returns basic disease ontology data including id, name, isTherapeuticArea flag (false), and therapeutic areas array with 2 IDs (EFO_0000540, OTAR_0000006). Used by Summary component to display either 'Therapeutic area' or 'Belongs to N therapeutic areas' text. No pagination - returns complete data. Related to OntologyQuery.gql which includes full ontology hierarchy (parents, children, ancestors)."
PhenotypesQuery,disease,packages/sections/src/disease/Phenotypes/PhenotypesQuery.gql,"Retrieves paginated phenotype data (clinical signs and symptoms) for a disease, including HPO and EFO phenotype mappings with detailed evidence annotations (aspect, bioCuration, evidence type, frequency, onset, modifiers, references, sex, resource)","disease, phenotypes, clinical-signs, symptoms, hpo, efo, evidence, pagination, section","efoId: String!, index: Int! (default: 0), size: Int! (default: 10)",✅ Success,"Paginated (uses page parameter with size and index, returns count field)","Query successfully tested with EFO_0000685 (rheumatoid arthritis). Returns count=16 phenotypes with complete HPO/EFO annotations and evidence details. Each phenotype includes HPO ID/name/description/namespace, EFO mapping, and evidence array with aspect (P/I/C/M/H), bioCuration, diseaseFromSource, evidenceType (IEA/PCS/TAS), frequency, frequencyHPO, qualifierNot, onset, modifiers, references (PMIDs), sex, and resource fields. Uses standard pagination via page.size and page.index parameters."
AdverseEventsSummaryFragment,drug,packages/sections/src/drug/AdverseEvents/AdverseEventsSummaryFragment.gql,Retrieves the count of adverse events associated with a drug from pharmacovigilance data,"drug, adverse-events, pharmacovigilance, safety, summary",chemblId: String!,✅ Success,Full results - no pagination in fragment,"Fragment converted to standalone query. Successfully tested with vemurafenib (CHEMBL1201585), returned count=19. The summary fragment only returns the total count; pagination is handled by the separate AdverseEventsQuery which uses page parameters."
AdverseEventsQuery,drug,packages/sections/src/drug/AdverseEvents/AdverseEventsQuery.gql,"Retrieves adverse events (pharmacovigilance data) for a drug from MedDRA, including event counts, log likelihood ratios, and critical value for significance testing","drug, adverse-events, pharmacovigilance, meddra, safety, log-likelihood-ratio, critical-value, pagination","chemblId: String!, index: Int (default: 0), size: Int (default: 10)",✅ Success,"Paginated (uses page parameter with index and size, returns count field)","Query successfully tested with CHEMBL1201585 (vemurafenib). Returns count=19 adverse events with complete data including event names, counts, logLR values, and meddraCode identifiers. Also includes criticalValue=364.92 for significance testing and separate maxLlr query (2714.55) to get maximum log likelihood ratio for visualization scaling. Top adverse events include ejection fraction decreased (1115 events, logLR=2714.55), myelosuppression (792 events, logLR=1991.55), and disease progression. Uses standard pagination via page.index and page.size parameters."
IndicationsQuery,drug,packages/sections/src/drug/Indications/IndicationsQuery.gql,"Retrieves drug indications with disease information, therapeutic areas, max phase, and references from ClinicalTrials and other sources","drug, indications, disease, therapeutic-areas, max-phase, clinical-trials, chembl, references",chemblId: String!,✅ Success,Full results - no pagination,"Query executes successfully. Tested with CHEMBL1201585 (vemurafenib), returned count=75 indications with complete data including disease names, therapeutic areas, maxPhaseForIndication values (1-4), and references from ClinicalTrials, ATC, EMA, and DailyMed sources. No pagination - returns all indications in a single response. Top indications include breast cancer (Phase 4), gastric cancer (Phase 4), and various other cancers with different development phases."
DrugWarningsSummaryFragment,drug,packages/sections/src/drug/DrugWarnings/DrugWarningsSummaryFragment.gql,"Fragment for retrieving drug warning summary information, specifically whether the drug has been withdrawn and if it has a black box warning. Used to display warning badges on drug summary pages.","drug, warnings, withdrawn, black-box, safety, summary, fragment",chemblId: String!,✅ Success,Full results - no pagination in fragment,"Fragment converted to standalone query. Successfully tested with vemurafenib (CHEMBL1201585), returned hasBeenWithdrawn=false and blackBoxWarning=true. Used by Summary component to display warning status in section header. Simple fragment without pagination."
DrugWarningsQuery,drug,packages/sections/src/drug/DrugWarnings/DrugWarningsQuery.gql,"Retrieves drug safety warnings, withdrawals, and black box warnings from regulatory agencies including FDA and EMA with toxicity classifications and references","drug, safety, warnings, black-box, withdrawal, toxicity, fda, ema, regulatory, adverse-events",chemblId: String!,✅ Success,Full results - no pagination,"Query executes successfully. Tested with CHEMBL1201585 (vemurafenib), returned 3 Black Box Warnings with toxicity classes (teratogenicity, respiratory toxicity, cardiotoxicity), country information (United States), and references from DailyMed and FDA. Also returns hasBeenWithdrawn=false and blackBoxWarning=true flags. Includes efoIdForWarningClass mappings for toxicity classes. No pagination - returns all drug warnings in a single response."
IndicationsSummaryFragment,drug,packages/sections/src/drug/Indications/IndicationsSummaryFragment.gql,Retrieves the count of indications (approved therapeutic uses) for a drug to display in the Indications section summary,"drug, indications, therapeutic-uses, count, summary, fragment",chemblId: String!,✅ Success,Full results - no pagination,"Originally a fragment, converted to standalone query. Successfully tested with CHEMBL1201585 (vemurafenib), returned count=75 indications. Used by Summary component to display indication count in section header (e.g., '75 indications'). Simple count query without pagination. Related to IndicationsQuery.gql which fetches full indication details including disease info, therapeutic areas, max phase, and references."
